{
  "event": "job.queued",
  "delivery": "01J8ZCP4V8M2QWX7KR5NB3TDH6",
  "occurred_at": "2026-08-28T19:31:12.044Z",
  "node": "origin-atl-01",
  "node_role": "origin",
  "contract_version": 1,
  "job": "job_01J8ZCA2R7F3H9NQ4KTX8VD5YB",
  "state": "queued",
  "priority": "normal",
  "idempotency_key": "video-941-v2",
  "outputs": [
    "hls_ladder",
    "audio"
  ],
  "source": {
    "destination_ref": "tsp-media",
    "key": "uploads/abc.mov"
  },
  "attempts": 0,
  "evictions": 0,
  "reason": "submitted",
  "labels": {
    "video_id": "941"
  }
}
